{
  "$schema": "https://json-schema.org/draft/2020-12/schema",
  "type": "object",
  "properties": {
    "schema_version": {
      "type": "string",
      "const": "scene_pack.v1"
    },
    "scene_id": {
      "type": "string",
      "pattern": "^[a-z0-9_-]+$"
    },
    "display_name": {
      "type": "string",
      "minLength": 1
    },
    "description": {
      "default": "",
      "type": "string"
    },
    "source": {
      "type": "object",
      "properties": {
        "format": {
          "type": "string",
          "minLength": 1
        },
        "path": {
          "type": "string",
          "minLength": 1
        }
      },
      "required": [
        "format",
        "path"
      ],
      "additionalProperties": false
    },
    "map": {
      "type": "object",
      "properties": {
        "tile_size": {
          "type": "integer",
          "exclusiveMinimum": 0,
          "maximum": 9007199254740991
        },
        "width": {
          "type": "integer",
          "exclusiveMinimum": 0,
          "maximum": 9007199254740991
        },
        "height": {
          "type": "integer",
          "exclusiveMinimum": 0,
          "maximum": 9007199254740991
        },
        "background_color": {
          "default": "#6f9f75",
          "type": "string",
          "pattern": "^#[0-9a-fA-F]{6}$"
        },
        "tiled_source": {
          "type": "string"
        }
      },
      "required": [
        "tile_size",
        "width",
        "height",
        "background_color"
      ],
      "additionalProperties": false
    },
    "tileset": {
      "type": "object",
      "properties": {
        "id": {
          "type": "string",
          "minLength": 1
        },
        "image": {
          "type": "string",
          "minLength": 1
        },
        "tile_width": {
          "type": "integer",
          "exclusiveMinimum": 0,
          "maximum": 9007199254740991
        },
        "tile_height": {
          "type": "integer",
          "exclusiveMinimum": 0,
          "maximum": 9007199254740991
        },
        "columns": {
          "type": "integer",
          "exclusiveMinimum": 0,
          "maximum": 9007199254740991
        },
        "tile_count": {
          "type": "integer",
          "exclusiveMinimum": 0,
          "maximum": 9007199254740991
        }
      },
      "required": [
        "id",
        "image",
        "tile_width",
        "tile_height",
        "columns",
        "tile_count"
      ],
      "additionalProperties": false
    },
    "layers": {
      "default": [],
      "type": "array",
      "items": {
        "type": "object",
        "properties": {
          "name": {
            "type": "string",
            "minLength": 1
          },
          "data": {
            "type": "array",
            "items": {
              "type": "integer",
              "minimum": -1,
              "maximum": 9007199254740991
            }
          }
        },
        "required": [
          "name",
          "data"
        ],
        "additionalProperties": false
      }
    },
    "landmarks": {
      "default": [],
      "type": "array",
      "items": {
        "type": "object",
        "properties": {
          "id": {
            "type": "string",
            "minLength": 1
          },
          "display_name": {
            "type": "string",
            "minLength": 1
          },
          "kind": {
            "type": "string",
            "minLength": 1
          },
          "bounds": {
            "type": "object",
            "properties": {
              "x": {
                "type": "integer",
                "minimum": 0,
                "maximum": 9007199254740991
              },
              "y": {
                "type": "integer",
                "minimum": 0,
                "maximum": 9007199254740991
              },
              "width": {
                "type": "integer",
                "exclusiveMinimum": 0,
                "maximum": 9007199254740991
              },
              "height": {
                "type": "integer",
                "exclusiveMinimum": 0,
                "maximum": 9007199254740991
              }
            },
            "required": [
              "x",
              "y",
              "width",
              "height"
            ],
            "additionalProperties": false
          },
          "render_mode": {
            "type": "string"
          }
        },
        "required": [
          "id",
          "display_name",
          "kind",
          "bounds"
        ],
        "additionalProperties": false
      }
    },
    "navigation": {
      "type": "object",
      "properties": {
        "blocked_tiles": {
          "default": [],
          "type": "array",
          "items": {
            "type": "object",
            "properties": {
              "x": {
                "type": "integer",
                "minimum": 0,
                "maximum": 9007199254740991
              },
              "y": {
                "type": "integer",
                "minimum": 0,
                "maximum": 9007199254740991
              }
            },
            "required": [
              "x",
              "y"
            ],
            "additionalProperties": false
          }
        }
      },
      "required": [
        "blocked_tiles"
      ],
      "additionalProperties": false
    },
    "zones": {
      "default": [],
      "type": "array",
      "items": {
        "type": "object",
        "properties": {
          "tags": {
            "default": [],
            "type": "array",
            "items": {
              "type": "string"
            }
          },
          "id": {
            "type": "string",
            "minLength": 1
          },
          "display_name": {
            "type": "string",
            "minLength": 1
          },
          "type": {
            "default": "",
            "type": "string"
          },
          "description": {
            "default": "",
            "type": "string"
          },
          "bounds": {
            "type": "object",
            "properties": {
              "x": {
                "type": "integer",
                "minimum": 0,
                "maximum": 9007199254740991
              },
              "y": {
                "type": "integer",
                "minimum": 0,
                "maximum": 9007199254740991
              },
              "width": {
                "type": "integer",
                "exclusiveMinimum": 0,
                "maximum": 9007199254740991
              },
              "height": {
                "type": "integer",
                "exclusiveMinimum": 0,
                "maximum": 9007199254740991
              }
            },
            "required": [
              "x",
              "y",
              "width",
              "height"
            ],
            "additionalProperties": false
          }
        },
        "required": [
          "tags",
          "id",
          "display_name",
          "type",
          "description",
          "bounds"
        ],
        "additionalProperties": false
      }
    },
    "surfaces": {
      "default": [],
      "type": "array",
      "items": {
        "type": "object",
        "properties": {
          "id": {
            "type": "string",
            "minLength": 1
          },
          "kind": {
            "type": "string",
            "enum": [
              "grass",
              "path",
              "plaza",
              "track",
              "water",
              "floor"
            ]
          },
          "bounds": {
            "type": "object",
            "properties": {
              "x": {
                "type": "integer",
                "minimum": 0,
                "maximum": 9007199254740991
              },
              "y": {
                "type": "integer",
                "minimum": 0,
                "maximum": 9007199254740991
              },
              "width": {
                "type": "integer",
                "exclusiveMinimum": 0,
                "maximum": 9007199254740991
              },
              "height": {
                "type": "integer",
                "exclusiveMinimum": 0,
                "maximum": 9007199254740991
              }
            },
            "required": [
              "x",
              "y",
              "width",
              "height"
            ],
            "additionalProperties": false
          }
        },
        "required": [
          "id",
          "kind",
          "bounds"
        ],
        "additionalProperties": false
      }
    },
    "props": {
      "default": [],
      "type": "array",
      "items": {
        "type": "object",
        "properties": {
          "id": {
            "type": "string",
            "minLength": 1
          },
          "kind": {
            "type": "string",
            "enum": [
              "building",
              "tree",
              "bench",
              "fountain",
              "vending_machine",
              "sign"
            ]
          },
          "bounds": {
            "type": "object",
            "properties": {
              "x": {
                "type": "integer",
                "minimum": 0,
                "maximum": 9007199254740991
              },
              "y": {
                "type": "integer",
                "minimum": 0,
                "maximum": 9007199254740991
              },
              "width": {
                "type": "integer",
                "exclusiveMinimum": 0,
                "maximum": 9007199254740991
              },
              "height": {
                "type": "integer",
                "exclusiveMinimum": 0,
                "maximum": 9007199254740991
              }
            },
            "required": [
              "x",
              "y",
              "width",
              "height"
            ],
            "additionalProperties": false
          },
          "label": {
            "type": "string"
          },
          "y_sort": {
            "default": false,
            "type": "boolean"
          }
        },
        "required": [
          "id",
          "kind",
          "bounds",
          "y_sort"
        ],
        "additionalProperties": false
      }
    },
    "anchors": {
      "default": [],
      "type": "array",
      "items": {
        "type": "object",
        "properties": {
          "tags": {
            "default": [],
            "type": "array",
            "items": {
              "type": "string"
            }
          },
          "id": {
            "type": "string",
            "minLength": 1
          },
          "display_name": {
            "type": "string",
            "minLength": 1
          },
          "description": {
            "default": "",
            "type": "string"
          },
          "position": {
            "type": "object",
            "properties": {
              "x": {
                "type": "integer",
                "minimum": 0,
                "maximum": 9007199254740991
              },
              "y": {
                "type": "integer",
                "minimum": 0,
                "maximum": 9007199254740991
              }
            },
            "required": [
              "x",
              "y"
            ],
            "additionalProperties": false
          },
          "facing": {
            "type": "string",
            "enum": [
              "down",
              "left",
              "right",
              "up"
            ]
          },
          "slots": {
            "default": [],
            "type": "array",
            "items": {
              "type": "object",
              "properties": {
                "id": {
                  "type": "string",
                  "minLength": 1
                },
                "position": {
                  "type": "object",
                  "properties": {
                    "x": {
                      "type": "integer",
                      "minimum": 0,
                      "maximum": 9007199254740991
                    },
                    "y": {
                      "type": "integer",
                      "minimum": 0,
                      "maximum": 9007199254740991
                    }
                  },
                  "required": [
                    "x",
                    "y"
                  ],
                  "additionalProperties": false
                },
                "facing": {
                  "type": "string",
                  "enum": [
                    "down",
                    "left",
                    "right",
                    "up"
                  ]
                }
              },
              "required": [
                "id",
                "position"
              ],
              "additionalProperties": false
            }
          },
          "interactions": {
            "default": [],
            "type": "array",
            "items": {
              "type": "string"
            }
          }
        },
        "required": [
          "tags",
          "id",
          "display_name",
          "description",
          "position",
          "slots",
          "interactions"
        ],
        "additionalProperties": false
      }
    },
    "spawns": {
      "default": [],
      "type": "array",
      "items": {
        "type": "object",
        "properties": {
          "id": {
            "type": "string",
            "minLength": 1
          },
          "position": {
            "type": "object",
            "properties": {
              "x": {
                "type": "integer",
                "minimum": 0,
                "maximum": 9007199254740991
              },
              "y": {
                "type": "integer",
                "minimum": 0,
                "maximum": 9007199254740991
              }
            },
            "required": [
              "x",
              "y"
            ],
            "additionalProperties": false
          },
          "facing": {
            "default": "down",
            "type": "string",
            "enum": [
              "down",
              "left",
              "right",
              "up"
            ]
          }
        },
        "required": [
          "id",
          "position",
          "facing"
        ],
        "additionalProperties": false
      }
    },
    "portals": {
      "default": [],
      "type": "array",
      "items": {
        "type": "object",
        "properties": {
          "id": {
            "type": "string",
            "minLength": 1
          },
          "position": {
            "type": "object",
            "properties": {
              "x": {
                "type": "integer",
                "minimum": 0,
                "maximum": 9007199254740991
              },
              "y": {
                "type": "integer",
                "minimum": 0,
                "maximum": 9007199254740991
              }
            },
            "required": [
              "x",
              "y"
            ],
            "additionalProperties": false
          },
          "target_scene_id": {
            "type": "string",
            "minLength": 1
          },
          "target_spawn_id": {
            "type": "string",
            "minLength": 1
          }
        },
        "required": [
          "id",
          "position",
          "target_scene_id",
          "target_spawn_id"
        ],
        "additionalProperties": false
      }
    },
    "activity_paths": {
      "default": [],
      "type": "array",
      "items": {
        "type": "object",
        "properties": {
          "id": {
            "type": "string",
            "minLength": 1
          },
          "activity_id": {
            "type": "string",
            "minLength": 1
          },
          "anchor_id": {
            "type": "string"
          },
          "loop": {
            "default": false,
            "type": "boolean"
          },
          "points": {
            "minItems": 1,
            "type": "array",
            "items": {
              "type": "object",
              "properties": {
                "x": {
                  "type": "integer",
                  "minimum": 0,
                  "maximum": 9007199254740991
                },
                "y": {
                  "type": "integer",
                  "minimum": 0,
                  "maximum": 9007199254740991
                }
              },
              "required": [
                "x",
                "y"
              ],
              "additionalProperties": false
            }
          }
        },
        "required": [
          "id",
          "activity_id",
          "loop",
          "points"
        ],
        "additionalProperties": false
      }
    }
  },
  "required": [
    "schema_version",
    "scene_id",
    "display_name",
    "description",
    "map",
    "layers",
    "landmarks",
    "navigation",
    "zones",
    "surfaces",
    "props",
    "anchors",
    "spawns",
    "portals",
    "activity_paths"
  ],
  "additionalProperties": false
}
