{
  "schema_version": "scene_pack.v1",
  "scene_id": "tracen_dorm_interiors",
  "display_name": "特雷森宿舍内部",
  "description": "由公共休息室、共享走廊、美浦寮双人房和栗东寮双人房组成的宿舍内部组合地图。",
  "source": {
    "format": "map_scene.v1",
    "path": "scene.map.json"
  },
  "map": {
    "tile_size": 32,
    "width": 52,
    "height": 36,
    "background_color": "#6f9f75"
  },
  "tileset": {
    "id": "tracen-campus",
    "image": "../../tilesets/tracen-campus/runtime-32.png",
    "tile_width": 32,
    "tile_height": 32,
    "columns": 8,
    "tile_count": 272
  },
  "layers": [
    {
      "name": "ground",
      "data": [
        251,
        251,
        251,
        251,
        251,
        251,
        251,
        251,
        251,
        251,
        251,
        251,
        251,
        251,
        251,
        251,
        251,
        251,
        251,
        251,
        251,
        251,
        251,
        251,
        251,
        251,
        251,
        251,
        251,
        251,
        251,
        251,
        251,
        251,
        251,
        251,
        251,
        251,
        251,
        251,
        251,
        251,
        251,
        251,
        251,
        251,
        251,
        251,
        251,
        251,
        251,
        251,
        251,
        251,
        251,
        251,
        251,
        253,
        253,
        253,
        253,
        253,
        253,
        253,
        253,
        251,
        251,
        251,
        251,
        251,
        251,
        251,
        251,
        251,
        251,
        251,
        251,
        251,
        251,
        251,
        251,
        251,
        251,
        251,
        251,
        251,
        251,
        251,
        251,
        251,
        251,
        253,
        253,
        253,
        253,
        253,
        253,
        253,
        253,
        251,
        251,
        251,
        251,
        251,
        251,
        251,
        251,
        251,
        251,
        251,
        251,
        251,
        251,
        251,
        251,
        251,
        251,
        251,
        251,
        251,
        251,
        251,
        251,
        251,
        251,
        251,
        251,
        251,
        251,
        251,
        251,
        251,
        251,
        251,
        251,
        251,
        251,
        251,
        251,
        251,
        251,
        251,
        251,
        251,
        251,
        251,
        251,
        251,
        251,
        251,
        251,
        251,
        251,
        251,
        251,
        251,
        252,
        252,
        252,
        252,
        252,
        252,
        252,
        252,
        252,
        252,
        252,
        252,
        252,
        252,
        252,
        252,
        252,
        252,
        252,
        252,
        252,
        252,
        252,
        252,
        252,
        252,
        252,
        252,
        252,
        252,
        252,
        252,
        252,
        252,
        252,
        252,
        252,
        252,
        252,
        252,
        252,
        252,
        252,
        252,
        252,
        252,
        252,
        252,
        252,
        252,
        252,
        252,
        83,
        248,
        248,
        248,
        248,
        248,
        248,
        248,
        248,
        248,
        248,
        248,
        248,
        248,
        248,
        248,
        248,
        248,
        248,
        248,
        248,
        248,
        248,
        248,
        248,
        248,
        248,
        248,
        248,
        248,
        248,
        248,
        248,
        248,
        248,
        248,
        248,
        248,
        248,
        248,
        248,
        248,
        248,
        248,
        248,
        248,
        248,
        248,
        248,
        248,
        248,
        83,
        83,
        248,
        248,
        248,
        248,
        248,
        248,
        248,
        248,
        248,
        248,
        248,
        248,
        248,
        248,
        248,
        248,
        248,
        248,
        248,
        248,
        248,
        248,
        248,
        248,
        248,
        248,
        248,
        248,
        248,
        248,
        248,
        248,
        248,
        248,
        248,
        248,
        248,
        248,
        248,
        248,
        248,
        248,
        248,
        248,
        248,
        248,
        248,
        248,
        248,
        248,
        83,
        83,
        248,
        248,
        248,
        248,
        248,
        248,
        248,
        248,
        248,
        248,
        248,
        248,
        248,
        248,
        248,
        248,
        248,
        248,
        248,
        248,
        248,
        248,
        248,
        248,
        248,
        248,
        248,
        248,
        248,
        248,
        248,
        248,
        248,
        248,
        248,
        248,
        248,
        248,
        248,
        248,
        248,
        248,
        248,
        248,
        248,
        248,
        248,
        248,
        248,
        248,
        83,
        83,
        248,
        248,
        248,
        248,
        248,
        248,
        248,
        248,
        248,
        248,
        248,
        248,
        248,
        248,
        248,
        248,
        248,
        248,
        248,
        248,
        248,
        248,
        248,
        248,
        248,
        248,
        248,
        248,
        248,
        248,
        248,
        248,
        248,
        248,
        248,
        248,
        248,
        248,
        248,
        248,
        248,
        248,
        248,
        248,
        248,
        248,
        248,
        248,
        248,
        248,
        83,
        83,
        248,
        248,
        248,
        248,
        248,
        248,
        248,
        248,
        248,
        248,
        248,
        248,
        248,
        248,
        82,
        82,
        82,
        82,
        82,
        82,
        82,
        82,
        82,
        82,
        82,
        82,
        82,
        82,
        82,
        82,
        82,
        82,
        82,
        82,
        82,
        82,
        248,
        248,
        248,
        248,
        248,
        248,
        248,
        248,
        248,
        248,
        248,
        248,
        248,
        248,
        83,
        83,
        248,
        248,
        248,
        248,
        248,
        248,
        248,
        248,
        248,
        248,
        248,
        248,
        248,
        248,
        82,
        82,
        82,
        82,
        82,
        82,
        82,
        82,
        82,
        82,
        82,
        82,
        82,
        82,
        82,
        82,
        82,
        82,
        82,
        82,
        82,
        82,
        248,
        248,
        248,
        248,
        248,
        248,
        248,
        248,
        248,
        248,
        248,
        248,
        248,
        248,
        83,
        83,
        248,
        248,
        248,
        248,
        248,
        248,
        248,
        248,
        248,
        248,
        248,
        248,
        248,
        248,
        82,
        82,
        82,
        82,
        82,
        82,
        82,
        82,
        82,
        82,
        82,
        82,
        82,
        82,
        82,
        82,
        82,
        82,
        82,
        82,
        82,
        82,
        248,
        248,
        248,
        248,
        248,
        248,
        248,
        248,
        248,
        248,
        248,
        248,
        248,
        248,
        83,
        83,
        248,
        248,
        248,
        248,
        248,
        248,
        248,
        248,
        248,
        248,
        248,
        248,
        248,
        248,
        82,
        82,
        82,
        82,
        82,
        82,
        82,
        82,
        82,
        82,
        82,
        82,
        82,
        82,
        82,
        82,
        82,
        82,
        82,
        82,
        82,
        82,
        248,
        248,
        248,
        248,
        248,
        248,
        248,
        248,
        248,
        248,
        248,
        248,
        248,
        248,
        83,
        83,
        248,
        248,
        248,
        248,
        248,
        248,
        248,
        248,
        248,
        248,
        248,
        248,
        248,
        248,
        82,
        82,
        82,
        82,
        82,
        82,
        82,
        82,
        82,
        82,
        82,
        82,
        82,
        82,
        82,
        82,
        82,
        82,
        82,
        82,
        82,
        82,
        248,
        248,
        248,
        248,
        248,
        248,
        248,
        248,
        248,
        248,
        248,
        248,
        248,
        248,
        83,
        83,
        248,
        248,
        248,
        248,
        248,
        248,
        248,
        248,
        248,
        248,
        248,
        248,
        248,
        248,
        82,
        82,
        82,
        82,
        82,
        82,
        82,
        82,
        82,
        82,
        82,
        82,
        82,
        82,
        82,
        82,
        82,
        82,
        82,
        82,
        82,
        82,
        248,
        248,
        248,
        248,
        248,
        248,
        248,
        248,
        248,
        248,
        248,
        248,
        248,
        248,
        83,
        83,
        248,
        248,
        248,
        248,
        248,